{
  "task_id": "gads-copy-001",
  "brief_id": "tc-lovefu-neck-pillow-search",
  "campaign_type": "search_rsa",
  "brand_name": "LOVEFU大島樂眠",
  "product_name": "量脖子頸椎枕",
  "generated_by": "codex",
  "generated_at": "2026-03-14T11:05:00+08:00",
  "angles": [
    {
      "key": "fit_measurement",
      "label": "量測適配",
      "rationale": "把量脖子服務當成明確差異化起點，讓產品選擇更有依據。"
    },
    {
      "key": "comfort_relief",
      "label": "肩頸放鬆",
      "rationale": "回應睡前常調整枕頭、肩頸容易緊的使用情境。"
    },
    {
      "key": "trial_guidance",
      "label": "試枕信任",
      "rationale": "用門市試枕與顧問引導降低選錯風險。"
    }
  ],
  "headlines": [
    {
      "text": "大島樂眠 量脖子選枕",
      "angle_key": "fit_measurement",
      "keyword_used": false
    },
    {
      "text": "頸椎枕推薦 先量脖子",
      "angle_key": "fit_measurement",
      "keyword_used": true
    },
    {
      "text": "量脖子枕頭 更貼近需求",
      "angle_key": "fit_measurement",
      "keyword_used": true
    },
    {
      "text": "找對枕高 比材質更重要",
      "angle_key": "fit_measurement",
      "keyword_used": false
    },
    {
      "text": "枕頭推薦 不只看材質",
      "angle_key": "fit_measurement",
      "keyword_used": true
    },
    {
      "text": "肩頸容易緊 找對枕頭",
      "angle_key": "comfort_relief",
      "keyword_used": false
    },
    {
      "text": "睡前少翻身 更快放鬆",
      "angle_key": "comfort_relief",
      "keyword_used": false
    },
    {
      "text": "枕頭太高太低都會累",
      "angle_key": "comfort_relief",
      "keyword_used": false
    },
    {
      "text": "頸椎枕頭推薦 看適配",
      "angle_key": "comfort_relief",
      "keyword_used": true
    },
    {
      "text": "讓肩頸慢慢放鬆",
      "angle_key": "comfort_relief",
      "keyword_used": false
    },
    {
      "text": "門市試枕 再帶回家",
      "angle_key": "trial_guidance",
      "keyword_used": false
    },
    {
      "text": "睡眠顧問陪你挑枕頭",
      "angle_key": "trial_guidance",
      "keyword_used": false
    },
    {
      "text": "大島樂眠 試枕更安心",
      "angle_key": "trial_guidance",
      "keyword_used": false
    },
    {
      "text": "台北試枕 預約了解",
      "angle_key": "trial_guidance",
      "keyword_used": false
    },
    {
      "text": "量脖子服務 幫你縮小選擇",
      "angle_key": "trial_guidance",
      "keyword_used": false
    }
  ],
  "descriptions": [
    {
      "text": "大島樂眠以量脖子服務協助你找到更適合的枕高，不只看材質，而是更貼近自己的睡姿與需求。",
      "angle_key": "fit_measurement"
    },
    {
      "text": "如果你常常翻來翻去還找不到舒服位置，歡迎先試枕，讓肩頸在更合適的支撐裡慢慢放鬆。",
      "angle_key": "comfort_relief"
    },
    {
      "text": "門市可試枕、可諮詢，睡眠顧問陪你比較不同枕感，降低把枕頭買回家才發現不適合的風險。",
      "angle_key": "trial_guidance"
    },
    {
      "text": "從量測到試枕都一步一步陪你做，讓選枕頭不再只靠猜，而是更安心地找到適合自己的睡感。",
      "angle_key": "trial_guidance"
    }
  ],
  "compliance_notes": {
    "manual_review_required": true,
    "checks_passed": [
      "exact_counts",
      "char_limits",
      "zh_tw_only",
      "three_distinct_angles"
    ],
    "policy_risks": [
      "頸椎相關詞彙需避免靠近治療、矯正等醫療語意"
    ],
    "brand_risks": [
      "量脖子概念較強，需確認 landing page 首屏是否同樣接住此承諾"
    ]
  }
}
